Music is ON	音樂：開啟
Music is OFF	音樂：關閉
Sound Effects are ON	音效：開啟
Sound Effects are OFF	音效：關閉
Week #%2d	第 %2d 週
You are not properly dressed for work!	你的穿著不適合上班！
You have missed too much work! You're fired!	你曠職太多次了！你被開除了！
$%d an hour	時薪 $%d
The software you are now using was produced\nthrough the efforts of many people:\ndesigners, artists, programmers, musicians,\nand many other hard-working professionals.\n\nIf you make copies of this software for any\nreason other than to make a personal backup,\nyou are not only breaking the law, but raising\nthe cost of software for all legitimate users.\n\nPLEASE\nDO NOT MAKE ILLEGAL COPIES OF THIS GAME !	您現在使用的這套軟體，\n是眾多人員辛勤努力的成果：\n設計師、美術、程式設計師、\n音樂家，以及其他專業人士。\n\n若您基於個人備份以外的理由\n複製本軟體，不僅觸犯法律，\n更會抬高所有正當使用者\n所負擔的軟體成本。\n\n請勿非法複製本遊戲！
