Music is ON	音樂 開啟
Now, if I can steer you towards some of our higher-margin products...	現在，如果我能引導你買一些我們利潤較高的產品…
Didn't you have your eye on that complete Home Videotape Production Studio?	你不是一直看著那套完整的家庭錄影製作室嗎？
If you're not completely satisfied, we'll be glad to give you partial credit.	如果你不完全滿意，我們很樂意給你部分折抵。
We're members of the Bait 'n Switch(TM) Retailer's Association!	我們是「誘餌欺詐」零售商協會的成員！
We finance 90 Days, Same as Bankruptcy!	我們提供 90 天分期付款，跟破產一樣！
With every purchase over $5200, we're giving away free Chapter 11 Auto-Filers!	購買超過 $5200，我們送免費破產第 11 章自動申請表！
Please be aware that our Extended Service Contract excludes parts and labor.	請注意我們的延長服務契約不包括零件和工資。
Welcome to QT Clothing. We will sell you anything, no matter how bad it looks.	歡迎來到 Q.T 服飾店。我們什麼都賣，不管看起來多難看。
Welcome to QT Clothing. Meet our tailor, Howie Fitzhugh!	歡迎來到 Q.T 服飾店。介紹我們的裁縫 Howie Fitzhugh！
Welcome to QT Clothing. Our ties don't bind and our belts are a cinch.	歡迎來到 Q.T 服飾店。我們的領帶不綁、腰帶很舒服。
Welcome to QT Clothing. We have legal briefs and law suits.	歡迎來到 Q.T 服飾店。我們有法律簡述和訴訟套裝。
Welcome to QT Clothing, open 24 hours...we never clothes!	歡迎來到 Q.T 服飾店，24 小時營業…我們從不打烊！
Welcome to QT Clothing. Thursday is Double Shoulder Pad Day!	歡迎來到 Q.T 服飾店。星期四是雙倍肩墊日！
Welcome to QT Clothing. Wear our clothes and you'll be a QT, too!	歡迎來到 Q.T 服飾店。穿上我們的衣服，你也會變成 Q.T！
Welcome to QT Clothing. The only place in the world where you can buy just 1 pant!	歡迎來到 Q.T 服飾店。世界上唯一可以只買 1 件褲子的地方！
Welcome to QT Clothing. Try on our soothing new Medicated Tux!	歡迎來到 Q.T 服飾店。試試我們舒緩的新醫療燕尾服！
My! Don't WE look nice today!	哇！我們今天看起來真漂亮！
It's the real you.	這才是真正的你。
Spiffy.	精美。
Faaabulous!!!	太棒了！！！
Our clothes are of the highest quality.	我們的衣服品質最高。
Have a wonderful day!	祝你有美好的一天！
Lookin' good!	看起來不錯！
You can't go wong at QT.	在 Q.T 不會出錯。
Perhaps you should stock up now while the prices are so reasonable.	也許你應該趁價格這麼合理時囤貨。
With your figure, perhaps you should consider going to a tent maker.	以你的身材，也許你應該考慮去帳篷店。
Oooh, you look good enough to eat!	唔，你看起來好吃到不行！
Don't you just love the new spring fashions? Tres magnifique!	你不喜歡新春裝嗎？非常優雅！
It's nice like that, just a tad tight around the bottom.	很不錯，就是下面稍微有點緊。
Good choice...rayon is back in this year!	好選擇…人造絲今年又流行了！
Now what are you going to do about your HAIR?	現在你要怎樣對付你的頭髮？
Don't forget to accessorize!	別忘了搭配配飾！
Nice! It really accentuates those pectorals.	不錯！真的突顯那些胸肌。
You know, a little tummy tuck would take care of that slight pucker in back.	你知道，小腹部整形就能解決後面那點皺紋。
Stop slouching and it won't crease across the torso.	停止駝背，就不會在軀幹上起褶。
With a physique like yours, you could wear ANYthing!	以你的身材，你可以穿任何東西！
Let me mention just two little words. Lipo. Suction.	讓我只說兩個小詞。抽脂。吸管。
Welcome to Monolith Burger. Our Assistant Manager knows the Heimlich Manuever!	歡迎來到大石頭漢堡店。我們的副經理懂海姆立克急救法！
Welcome to Monolith Burger. Next week, come meet Monny the Burger Clown!	歡迎來到大石頭漢堡店。下週來見我們的漢堡小丑 Monny！
Welcome to Monolith Burger. You just missed Monny the Burger Clown!	歡迎來到大石頭漢堡店。你剛好錯過漢堡小丑 Monny！
Welcome to Monolith Burger. Buy 'em by the bushel!	歡迎來到大石頭漢堡店。一大堆買吧！
Welcome to Monolith Burger. Our food is untouched by human hands, only by teenagers.	歡迎來到大石頭漢堡店。我們的食物沒被人類的手碰過，只被少年碰過。
Welcome to Monolith Burger. Cleanest restrooms in the game!	歡迎來到大石頭漢堡店。遊戲裡最乾淨的廁所！
Welcome to Monolith Burger. Free bibs with every order of Lobster Nuggets!	歡迎來到大石頭漢堡店。每份龍蝦塊都送免費圍兜！
Welcome to Monolith Burger. Try a box of Chocolate-Like(R) Cookie Shards!	歡迎來到大石頭漢堡店。試試一盒巧克力風味® 餅乾碎片！
Welcome to Monolith Burger. Have you played our Guess the Chicken Part Game?	歡迎來到大石頭漢堡店。你玩過我們的「猜雞肉部位」遊戲嗎？
Welcome to Monolith Burger. Special orders will take an extra 45 minutes.	歡迎來到大石頭漢堡店。特別訂單需要額外 45 分鐘。
Welcome to Monolith Burger. Our soup today is Cream of Taco.	歡迎來到大石頭漢堡店。今天的湯是玉米餅奶油湯。
Welcome to Monolith Burgers. Home of the Toemain Express and the Stomach Pump special.	歡迎來到大石頭漢堡店。腳趾明快特餐和胃泵特餐的家鄉。
Welcome to Monolith Burgers, where we use only 100% Pure Extruded Beeflike Product!	歡迎來到大石頭漢堡店，我們只用 100% 純擠出式牛肉類產品！
Welcome to Monolith Burgers, where even the wrappers have wrappers!	歡迎來到大石頭漢堡店，連包裝紙都有包裝！
Welcome to Monolith Burgers, where our Food(TM) is patented!	歡迎來到大石頭漢堡店，我們的食物® 是專利產品！
Welcome to Monolith Burgers. Our buns are the softest!	歡迎來到大石頭漢堡店。我們的麵包最柔軟！
Welcome to Monolith Burgers, where our fat is always freshly rendered!	歡迎來到大石頭漢堡店，我們的油脂總是新鮮熬製！
Welcome to Monolith Burgers, where quality eats are in the bag!	歡迎來到大石頭漢堡店，優質美食就在袋子裡！
Welcome to Monolith Burgers, where our drinks have twice the ice!	歡迎來到大石頭漢堡店，我們的飲料有兩倍的冰！
Welcome to Monolith Burgers, where our burgers come from contented cows!	歡迎來到大石頭漢堡店，我們的漢堡來自滿足的牛！
Will that be all?	就這些嗎？
Would you like fries with that?	要加薯條嗎？
Something else with that?	還要別的嗎？
Take some home for your family too.	帶一些回家給你的家人。
Have a nice day.	祝你愉快。
Sounds delicious.	聽起來很好吃。
Will that be cash or charge? Tee hee.	要付現還是刷卡？呵呵。
Well, aren't WE happy today.	嗯，我們今天真開心呀。
Would you like some Thousand Isla...I mean, Secret Sauce, with that?	要加千島…我是說秘製醬汁嗎？
Does your Mother know you're eating here?	你媽知道你在這裡吃飯嗎？
Incidentally, we also sell used hairnets.	順便說一下，我們也賣二手髮網。
Our pure beef burgers have half the soybeans of the other leading brands!	我們的純牛肉漢堡的大豆含量只有其他品牌的一半！
Would you like some deep-fried potatoes and deep-fried pie with your deep-fried sandwich?	要加炸薯條和炸派來配你的炸三明治嗎？
This week only: buy two burgers and get the shakes for free!	本週特惠：買兩個漢堡送免費奶昔！
You can save 45 minutes by flushing that right now.	你現在把那個沖掉就能省 45 分鐘。
Mmmmm...that looks almost good enough to eat!	唔…看起來幾乎可以吃啦！
We now make our sandwiches from 100% biodegradable material!	我們現在用百分之百可分解的材料做三明治！
Is that 'to go,' to eat here, or neither?	要外帶、內用，還是都不要？
Please dispose of trash properly!	請妥善處理垃圾！
Would you like a Prepubescent Irradiated Kung Fu Tortise statuette with that?	要加一個未成熟輻照功夫龜雕像嗎？
Our Manager would like you to sign a petition to abolish the Minimum Wage.	經理希望你簽署廢除最低薪資的\n請願書。
Did you know there's only 45 calories per french fry?	你知道嗎？每根薯條只有 45 卡路里。
Next to disposable diapers, we're the most familiar sight on the highways!	除了一次性尿布，我們是高速公路上\n最常見的景象！
Have you tried our new Breakfast Chile Releno?	你試過我們新推出的早餐\n辣椒釀起司嗎？
This is my first job, so forgive me if I totally mess up your order.	這是我的第一份工作，如果我搞砸\n你的訂單，請原諒我。
Try our new Licorice 'n Liver Shake!	試試我們的新甘草肝臟奶昔！
Did you want a handful of ketchup packets with that?	要加一把番茄醬包嗎？
Remember, if it's a 6-lb. Beefburger, it must be a Monolith!	記住，如果是六磅漢堡，\n一定是大石頭漢堡！
Our burgers aren't broiled OR fried...they're poached!	我們的漢堡不是烤的也不是炸的…\n是水煮的！
You can find us in any town...just follow the trail of empty wrappers!	你可以在任何地方找到我們…\n只要跟著空包裝紙的軌跡！
Remember...NO food is better than OUR food!	記住…沒有食物比我們的食物\n更好吃！
Would you like to take home some complimentary advertising on a placemat?	要帶一個免費廣告墊子回家嗎？
Our shakes are so thick, you can't even swallow 'em!	我們的奶昔太濃稠了，\n你根本吞不下去！
Help yourself to a piece of our new 90-foot Compressed Salad Bar!	自取一份我們的新九十呎\n壓縮沙拉吧！
Free refills if you can finish one cup of our coffee!	如果能喝完一杯我們的咖啡，\n免費續杯！
Welcome to Z-Mart. Home of low cost, low quality, and cheap help.	歡迎來到 Z-超商。低成本、低品質、廉價勞工的家。
Welcome to Z-Mart, where low prices don't always mean low quality!	歡迎來到 Z-超商，低價不一定\n代表低品質！
Welcome to Z-Mart. Our overhead is so low, the clerks are stoop- shouldered!	歡迎來到 Z-超商。我們的開銷這麼低，\n店員都駝背了！
Welcome to Z-Mart. Our overhead is so low, we hire only midgets!	歡迎來到 Z-超商。我們的開銷這麼低，\n只聘請小矮人！
Welcome to Z-Mart. If we see a line with more than 50 people waiting, we'll open another!	歡迎來到 Z-超商。如果看到超過\n五十人排隊，我們會開第二台收銀機！
Welcome to Z-Mart, where our everyday values are other stores' remainders!	歡迎來到 Z-超商，我們的日常商品\n是其他店的滯銷品！
Welcome to Z-Mart, where shoddy merchandise comes home to roost!	歡迎來到 Z-超商，劣質商品\n在此落地生根！
Welcome to Z-Mart, where yesterday's trash is today's bargain!	歡迎來到 Z-超商，昨天的廢品\n是今天的便宜貨！
Welcome to Z-Mart. If you can't find it here, it must be worth having!	歡迎來到 Z-超商。如果在這裡找不到，\n那就表示真的值得擁有！
Welcome to Z-Mart, where Quality is something we often talk about!	歡迎來到 Z-超商，品質是我們\n經常談論的東西！
Welcome to Z-Mart, where we've closed over 600 stores from coast- to-coast!	歡迎來到 Z-超商，我們已從東到西\n關閉超過六百家分店！
Thank you for shopping at Z-Mart.	感謝您在 Z-超商購物。
Have a very good day!	祝你有美好的一天！
Have you checked out our red light specials?	你看過我們的紅燈特價嗎？
Please visit us again soon.	請盡快再來訪問我們。
Can I have a price check on register two please!	請幫我查一下第二台\n收銀機的價格！
Come back again. We have new specials each week.	再回來。我們每週都有新特價。
If you want cheap, we got it.	如果想要便宜貨，我們有。
Save some for our next...customer.	留一些給我們的下一位…顧客。
Well, you get what you pay for!	嗯，一分錢一分貨！
Check out our new shipment of Taiwanese microwave cozies!	看看我們新進的台灣製\n微波爐套！
Don't forget to look in Aisle 14 for slightly irregular automotive parts!	別忘了去第十四走廊看\n有點不規則的汽車零件！
Be sure to look for our service department...and if you find it, let us know!	務必找我們的服務部…\n如果你找到了，請告訴我們！
Have you noticed our 83-piece steak knife set for only $4.95?	你注意到我們的八十三件牛排刀組\n只要 $4.95 嗎？
We're having a special on dented or scratched floppy disks...only $3.50 a box!	我們的凹陷或刮傷磁片特價…\n每盒只要 $3.50！
Take a look in Aisle 22 for half-price batteries. Sorry, demo models only!	去第二十二走廊看半價電池。\n抱歉，只有展示模型！
If you don't see what you're looking for, look underneath something else!	如果看不到你要的，\n就看別的東西下面！
Welcome to the Pawn Shop. Nothing is too hot for us to handle.	歡迎來到當舖。沒有我們\n處理不了的東西。
Welcome to the Pawn Shop. Down on your luck? Save the story for someone who hasn't heard it.	歡迎來到當舖。運氣不好？\n把故事留給沒聽過的人。
Welcome to the Pawn Shop. I may look mean on the outside, but I've got a heart of stone.	歡迎來到當舖。我看起來凶，\n但我有顆石頭般的心。
Welcome to the Pawn Shop. Why crawl to anybody else?	歡迎來到當舖。為什麼要去\n別人那邊？
Welcome to the Pawn Shop, where we pardon your beg!	歡迎來到當舖，我們原諒你的乞求！
Welcome to the Pawn Shop. Your first stop on the way down the corporate ladder!	歡迎來到當舖。你走下公司階梯\n的第一站！
Welcome to the Pawn Shop. Where 'pawn' is just another word for nothing left to lose!	歡迎來到當舖。「當舖」就是\n「一無所有」的另一個詞！
Welcome to the Pawn Shop. Please don't beg, it scuffs the carpet.	歡迎來到當舖。請別乞求，\n會刮傷地毯。
If ya ever need cash, I'm here.	你什麼時候需要現金，我就在這。
Y'all com'back now, y'hear.	各位再來喔，聽到沒。
You know a good deal when you see one.	你看得出好交易。
Come and see us again please.	請再來看我們。
What else can I do for ya today?	今天還能幫你什麼？
Can I interest you in something else?	要不要考慮買別的？
You don't have anything to sell.	你沒有東西可賣。
No Redeemable Items.	沒有可贖回的物品。
No Pawned Items For Sale.	沒有典當物品出售。
Sorry, I really do not have room to buy anything else.	抱歉，我真的沒有空間\n買別的了。
Sorry, I don't need another one of those.	抱歉，我不需要再要一個。
I'll give you $%d for your %s, take it or leave it.	我出 $%d 買你的 %s，要不要。
Market	市價
Value	價值
Your	你的
Holdings	持有物
You don't have enough cash!	你現金不足！
A $3 Broker's fee is deducted for the sale of each T-Bill.	每次售出公債會扣 $3 的經紀費。
You do not own any shares.	你沒有持有任何股票。
DUMMY	虛擬
BANKS FALTER!\nSAVINGS LOST!  JOBS LOST!	銀行搖搖欲墜！\n存款賠光！  工作沒了！
SCANDAL ON WALL ST.  ECONOMY\nDROPS! UNEMPLOYMENT RISES	華爾街醜聞！  經濟\n下跌！失業率飆升
MORE S & L'S FAIL!\nECONOMY SUFFERS	更多儲貸機構倒閉！\n經濟受創
INFLATION IS UP\nPRICES COULD SOAR!	通脹飆升\n物價可能暴漲！
GOLD OUTLOOK IS GOOD	黃金前景看好
GOLD INVESTMENTS\nLOOK TARNISHED	黃金投資\n前景黯淡
GOOD TIMES AHEAD FOR SILVER	白銀前景光明
EXPERTS AGREE\nGET OUT OF SILVER	專家一致認為\n賣出白銀
PRESIDENT EATS PORK RINDS	總統吃豬皮
GENERAL POPULATION HATES\nPORK RINDS	大眾討厭\n豬皮
BLUE CHIP STOCKS\nOUTLOOK ROSEY	績優股\n前景看好
HARD TIMES AHEAD\nFOR BIG BLUE	龍頭股將面臨\n困難時期
PENNY STOCKS ARE WISE\nINVESTMENT	便宜股是明智的\n投資
PENNY STOCKS NOT\nWORTH A DIME	便宜股\n一文不值
WILD WILLY RIPS OFF\nANOTHER APARTMENT	瘋狂威利又\n騙走一套公寓
WILD WILLY HAS LIFTED\nANOTHER WALLET	瘋狂威利又\n偷了一個皮夾
BIG LOTTERY WINNER!	大樂透得主！
INVESTMENTS RECOMMENDED	建議投資
INVESTMENTS NOT RECOMMENDED	不建議投資
ECONOMIC OUTLOOK GOOD	經濟前景良好
ECONOMIC OUTLOOK POOR	經濟前景不佳
UNEMPLOYMENT IS ON\nTHE RISE	失業率正在\n上升
UNEMPLOYMENT IS DOWN	失業率下降
NOBODY YOU KNOW\nWON THE LOTTO!	沒有你認識的人\n贏得樂透！
PRESIDENT HATES BROCCOLI	總統討厭花椰菜
MORE FAST FOOD PLACES\nUSING SOY BEANS	更多速食店\n採用黃豆
SCHOOL ENROLLMENT UP	學校招生人數增加
SCHOOL ENROLLMENT DOWN	學校招生人數下降
THERE IS MONEY IN\nCOMPUTERS	電腦業有金礦\n待開採
HOUSING MARKET LOOKS GOOD	房市看好
SALES OF NEWSPAPERS\nHAVE SKYROCKETED	報紙銷售\n暴增
PAWN SHOPS SERVE\nUSEFUL PURPOSE	當舖發揮\n重要作用
NORTH SHORE OF BASS\nLAKE SINKS	低音湖北岸\n下沉
ALICE COOPER GIVES BIRTH\nTO TWIN BOYS	愛麗絲．庫柏誕下\n雙胞胎男嬰
COARSEGOLD PURCHASED BY\nJAPAN	粗金鎮被日本\n收購
SPACE QUEST III WINS\nBIG AWARD	太空探險隊III\n贏得大獎
ELVIS SIGHTED AT KFC\nIN OAKHURST	貓王在橡樹鎮\nKFC 現身
TALKING BEAR KIDNAPPED!\nFBI INVESTIGATING	會說話的熊遭綁架！\nFBI 正在調查
KINGS QUEST XXIX GOES\nTO PRODUCTION	國王任務XXIX\n進入製作
MR. WHIPPLE FOUND SQUEEZED\nTO DEATH IN APARTMENT	威普爾先生在公寓內\n遭擠死
REAGAN'S NAP INTERRUPTS\nSPEECH	雷根打盹\n打斷演講
MOTHER GOOSE GETS DIVORCE!\nFEATHERS RUFFLED	鵝媽媽離婚！\n羽毛都豎起來了
MOTHER GOOSE SUSPECTED OF\nFOWL PLAY	鵝媽媽涉嫌\n違規行為
SALMON BITING OFF NORTH\nSHORE OF BASS LAKE	鮭魚在低音湖北岸\n頻繁咬人
NIXON MAKES ROCK VIDEO	尼克森拍搖滾音樂錄影帶
FORD STUMBLES ON CURE	福特意外發現治療法
NEW GOVT STUDY SHOWS GAME\nPLAYERS GET SICK TOO!	新政府研究顯示\n電玩玩家也會生病！
AMELDA M. LOOKING FOR\nA FEW GOOD SHOES	艾美達．M 尋找\n幾雙漂亮的鞋
NANCY IS LOOKING FOR A\nNEW DRESS	南茜在尋找\n新衣服
TYpEsETTrs U ion\ngoe oN STR KE!	排字工人工會\n罷工！
FIREMEN ARE ALWAYS\nIN HEAT	消防員永遠\n熱血沸騰
PRESIDENT FINALLY EATS\nBROCCOLI	總統終於\n吃花椰菜
PRESIDENT EATS BROCCOLI\nAND LIVES!	總統吃花椰菜\n而且活著！
STUDY SHOWS WE HAVE\nMORE LEISURE TIME	研究顯示我們擁有\n更多休閒時間
SOL.\nWE NEED A HEADLINE HERE!	天哪。\n我們需要頭條新聞！
TORNADO KILLS 8 THEN\nCOMMITS SUICIDE!	龍捲風殺害8人\n然後自殺！
CIGARETTES FOUND TO CAUSE\nLABORATORY ANIMALS!	香菸被發現導致\n實驗動物！
COURTS JAMMED!\nWAPNER REINSTATED!	法院爆滿！\nWapner 恢復主持！
GRAND CANYON DESIGNATED\nNATIONAL LANDFILL!	大峽谷被指定為\n國家垃圾掩埋場！
CELEBRITY BULLFIGHTING\nDISASTER; LESLEY GORED	名人鬥牛\n事故；萊斯利遭刺傷
GURUKA SINGH GETS HAIRCUT!\nPHOTOS UNDER WRAPS!	古魯卡．辛格剪髮！\n照片保密！
RAP GROUP ARRESTED FOR\nNOT STARTING RIOT!	嘻哈樂團因未\n引發暴動遭捕！
TRAILER PARK DEMOLISHES\n6 TORNADOES!	房車停車場摧毀\n6 場龍捲風！
Works at %-16s	工作於 %-16s
As a %-20s	身分為 %-20s
Hourly wage: $%-11d	時薪：$%-11d
Unemployed	失業中
Cash: $%-18s	現金：$%-18s
Savings: $%-15s	存款：$%-15s
Rent Owed: $%-13d	欠房租：$%-13d
Loan Balance: $%-10d	貸款餘額：$%-10d
Total Goods: $%-11d	總財產值：$%-11d
Investment Total: $%-6s	投資總額：$%-6s
Net Worth: $%-13s	淨資產：$%-13s
-----GOODS-----	-----商品-----
Casual Clothes  	便服
Dress Clothes   	禮服
Business Suit   	商務套裝
%3d Weeks of Food        	%3d 週的食物
---EDUCATION---	---教育---
--INVESTMENTS--	--投資--
Filler	填充
You spent the whole weekend watching some of the food in your refrigerator grow mold and spores. It sure was fun.	你整個週末都在看冰箱裡的食物長黴菌和孢子。真的很有趣。
You spent the whole weekend watching the water in your refrigerator freeze.	你整個週末都在看冰箱裡的水結冰。
You spent the weekend baking oatmeal cookies.	你週末烤燕麥餅乾。
You spent the entire weekend watching Star Trek reruns.	你整個週末都在看星艦奇航記重播。
You rented some movies and ate artificially flavored buttered popcorn.	你租了些電影並吃了人工香味奶油爆米花。
You spent the weekend playing your stereo and patching the plaster your speakers cracked.	你週末放立體聲音樂並修補揚聲器裂開的牆面。
You spent the weekend cleaning your microwave after you tried to dry your pet rat in it. You also need a new pet rat.	你週末清潔微波爐，因為你試著在裡面烘乾寵物鼠。你還需要一隻新寵物鼠。
You and some friends had a Hottub party this weekend.	你和一些朋友週末舉辦了熱水浴池派對。
You played games on your computer all weekend.	你整個週末都在玩電腦遊戲。
You watched CELEBRITY INCOME TAX EVASION on TV this weekend.	你週末看電視上的「名人逃稅」節目。
You read all about the mating habits of the North American computer programmer in your encyclopedia.	你在百科全書中讀了北美電腦程式設計師的交配習性。
You read your dictionary all weekend. Boy, that was fun.	你整個週末都在讀字典。天哪，真有趣。
You read your atlas and commited the population of 43 countries to memory. OH WOW!!!	你讀地圖集並記住了43個國家的人口。喔哇！！！
You went to the baseball game this weekend and ate hotdogs till you puked.	你週末去看棒球比賽並吃熱狗直到吐。
You went to the theatre this weekend and saw the one MAN version of Cats.	你週末去劇院看了「貓」的獨角戲版本。
You had front row seats at a rock concert. The doctor said that the hearing loss shouldn't be permanent.	你在搖滾演唱會有前排座位。醫生說聽力損失應該不會永久。
You watched them change the mannequins at QT Clothing this weekend.	你週末看了Q.T服飾店換衣服模特的過程。
You washed and waxed your marble this weekend right before it rained.	你週末洗臘大理石，結果馬上下雨。
You stayed home and did absolutely nothing this weekend.	你週末待在家裡什麼都沒做。
You spent the weekend hiking around Yosemite.	你週末在優勝美地登山。
You listened to the Talking Bear 256 times this weekend.	你週末聽了會說話的熊256次。
You read the 'Wall Street Journal' this weekend.	你週末讀了《華爾街日報》。
You thought about what you would do on your next turn.	你想著下次輪到你時要做什麼。
You spent the weekend in a hotel because they had to fumigate your apartment.	你週末在飯店住，因為他們必須對你的公寓進行薫蒸。
You played in a ping pong tournament this weekend.	你週末參加了乒乓球錦標賽。
You pitched horseshoes in your apartment all weekend. The people downstairs love you.	你整個週末都在公寓裡扔馬蹄鐵。樓下的人很愛你。
You sat around and played solitaire all weekend.	你整個週末都坐著玩紙牌遊戲。
You went panning for gold this weekend, but all you got was wet.	你週末去淘金，但只淘到了水。
You spent the weekend in the laundromat washing your clothes. Now that was exciting.	你週末在洗衣店洗衣服。那真刺激。
You took a friend out to a cheap restaurant this weekend.	你週末帶朋友去便宜餐廳。
You went out and caught your own froglegs this weekend.	你週末出去自己抓青蛙腿。
You crawled around on your knees chasing snails this weekend.	你週末跪著爬行追逐蝸牛。
You spent your weekend thinking about work. Eccch.	你週末想著工作。呃。
You spent your weekend trying to remove the mildew between the shower tiles.	你週末試著清除淋浴瓷磚間的黴菌。
You spent the weekend listening to the newlyweds in the next apartment set up a new waterbed.	你週末聽著隔壁公寓的新婚夫婦設置新水床。
This weekend, you won first prize in a beauty contest and collected $10. Whoops, wrong game.	這個週末，你在選美比賽贏得首獎並獲得$10。糟糕，遊戲錯了。
This weekend, you closed your curtains, locked your doors, turned off the lights, and ate presweetened morning breakfast cereal, with little marshmallows!	這個週末，你關上窗簾、鎖上門、關上燈、吃加糖早餐穀物加小棉花糖！
You played stickball this weekend with the neighborhood kids and ended up wrenching your back and spraining your ankle.	你這個週末和鄰居小孩玩棒壘球，結果扭傷了背部和腳踝。
You read a romance novel, NURSE'S TURN TO CRY, in one sitting.	你一口氣讀完了言情小說《護士的哭泣時刻》。
You took a long hot bath this weekend and emerged looking like a California Raisin.	你這個週末洗了很久的熱水澡，結果看起來像加州葡萄乾。
You watched a torrid romance movie, LIBRARIAN'S DILEMMA, this weekend.	你這個週末看了熾熱的言情電影《圖書館員的困境》。
One of your fillings came loose this weekend. It's a good thing you're handy with a soldering iron.	你這個週末的補牙脫落了。幸好你對焊槍得心應手。
You spent the weekend examining yourself under the fluorescent lights in the bathroom. Eccch!	你花了整個週末在浴室的日光燈下檢查自己。噁！
You spent the weekend wondering if black holes were lit with black lights.	你花了整個週末想知道黑洞是否用黑光照亮。
